Likes,Comments,Shares,Profile Visits,Follows,Engagement,Caption,Hashtags
162,9,5,35,2,3920,Here are some of the most important data visualizations that every Financial Data Analyst/Scientist should know.,#finance #money #business #investing #investment #trading #stockmarket #data #datascience #dataanalysis #dataanalytics #datascientist #machinelearning #python #pythonprogramming #pythonprojects #pythoncode #artificialintelligence #ai #dataanalyst #amankharwal #thecleverprogrammer
224,7,14,48,10,5394,Here are some of the best data science project ideas on healthcare. If you want to become a data science professional in the healthcare domain then you must try to work on these projects.,#healthcare #health #covid #data #datascience #dataanalysis #dataanalytics #datascientist #machinelearning #python #pythonprogramming #pythonprojects #pythoncode #artificialintelligence #ai #dataanalyst #amankharwal #thecleverprogrammer
131,11,1,62,12,4021,Learn how to train a machine learning model and giving inputs to your trained model to make predictions using Python.,#data #datascience #dataanalysis #dataanalytics #datascientist #machinelearning #python #pythonprogramming #pythonprojects #pythoncode #artificialintelligence #ai #deeplearning #machinelearningprojects #datascienceprojects #amankharwal #thecleverprogrammer #machinelearningmodels
213,10,7,23,8,4528,Here’s how you can write a Python program to detect whether a sentence is a question or not. The idea here is to find the words that we see in the beginning of a question in the beginning of a sentence.,#python #pythonprogramming #pythonprojects #pythoncode #pythonlearning #pythondeveloper #pythoncoding #pythonprogrammer #amankharwal #thecleverprogrammer #pythonprojects
123,5,4,8,0,2518,Plotting annotations while visualizing your data is considered good practice to make the graphs self-explanatory. Here is an example of how you can annotate a graph using Python.,#datavisualization #datascience #data #dataanalytics #machinelearning #dataanalysis #artificialintelligence #python #datascientist #bigdata #deeplearning #dataviz #ai #analytics #technology #dataanalyst #programming #pythonprogramming #statistics #coding #businessintelligence #datamining #tech #business #computerscience #tableau #database #thecleverprogrammer #amankharwal
144,7,10,9,2,3884,Here are some of the most important soft skills that every data scientist should have.,#data #datascience #dataanalysis #dataanalytics #datascientist #machinelearning #python #pythonprogramming #pythonprojects #pythoncode #artificialintelligence #ai #deeplearning #algorithm #algorithms #machinelearningalgorithms #ml #amankharwal #thecleverprogrammer #softskills
76,5,1,26,0,2621,Learn how to analyze a candlestick chart as a data scientist or a financial analyst. I hope this resource will help you to invest and analyze stock markets.,#stockmarket #investing #stocks #trading #money #investment #finance #forex #datavisualization #datascience #data #dataanalytics #machinelearning #dataanalysis #ai #candlestick #candlestickcharts
124,4,9,12,6,3541,Here are some of the best books that you can follow to learn Python from scratch.,#python #pythonprogramming #pythonprojects #pythoncode #pythonlearning #pythondeveloper #pythoncoding #pythonprogrammer #amankharwal #thecleverprogrammer #pythonprojects #pythonbooks #bookstagram
159,6,8,36,4,3749,Here are some of the best data analysis project ideas that you should try and show on your resume. These projects will help you to show your data analysis skills.,#dataanalytics #datascience #data #machinelearning #datavisualization #bigdata #artificialintelligence #datascientist #python #analytics #ai #dataanalysis #deeplearning #technology #programming #coding #dataanalyst #business #pythonprogramming #datamining #tech #businessintelligence #database #computerscience #statistics #powerbi #dataanalysisprojects #businessanalytics #thecleverprogrammer #amankharwal
191,6,3,31,6,4115,Here are two best ways to count the number of letters in a string using Python.,#python #pythonprogramming #pythonprojects #pythoncode #pythonlearning #pythondeveloper #pythoncoding #pythonprogrammer #amankharwal #thecleverprogrammer #pythonprojects
81,6,3,29,4,2218,Learn the implementation of AlexNet Convolutional Neural Network using Python. Link in Bio,#neuralnetwork #machinelearning #artificialintelligence #deeplearning #python #ai #datascience #neuralnetworks #programming #tensorflow #datascientist #pythonprogramming #tech #technology #artificialintelligenceai #machinelearningalgorithms #computerscience #coding #ml #data #amankharwal #thecleverprogrammer #alexnet
151,8,14,15,0,3234,Here’s how to get the live stock price data of any company by using the Python programming language.,#python #pythonprogramming #pythonprojects #pythoncode #pythonlearning #pythondeveloper #pythoncoding #pythonprogrammer #amankharwal #thecleverprogrammer #pythonprojects
162,7,11,8,2,4344,"Here are some of the most important Python libraries for data science. If you know the fundamentals of all these Python libraries, you can work on any kind of data science problem.",#data #datascience #dataanalysis #dataanalytics #datascientist #machinelearning #python #pythonprogramming #pythonprojects #pythoncode #artificialintelligence #ai #deeplearning #algorithm #algorithms #machinelearningalgorithms #ml #amankharwal #thecleverprogrammer
142,5,5,20,4,3216,Here’s how to visualize an interactive candlestick chart using Python.,#stockmarket #investing #stocks #trading #money #investment #finance #forex #datavisualization #datascience #data #dataanalytics #machinelearning #dataanalysis #ai #candlestick #candlestickcharts #amankharwal #thecleverprogrammer
294,6,10,181,42,9453,Omicron Variant Sentiment Analysis using Python: Link in Bio,#data #datascience #dataanalysis #dataanalytics #datascientist #machinelearning #python #pythonprogramming #pythonprojects #pythoncode #artificialintelligence #ai #deeplearning #sentimentanalysis #sentiment #nlp #naturallanguageprocessing #amankharwal #thecleverprogrammer
159,7,11,17,6,5055,"In Data Science, Time Series Analysis is a method of analyzing data collected over an interval of time. Stock price data and covid-19 cases data are examples of time-series data. Time Series Analysis helps understand the underlying causes of trends and patterns at particular time intervals. So it is one of the topics that every data scientist should know perfectly. So if you are looking for some of the best books to learn Time Series Analysis, you can choose any one among these books.",#timeseries #time #statistics #datascience #bigdata #machinelearning #python #ai #timeseriesanalysis #datavisualization #dataanalytics #data #iot #analysis #timeseriesmalaysia #artificialintelligence #analytics #amankharwal #thecleverprogrammer
205,17,18,16,2,4002,"Here are some of the highest paying skills in 2022 that you should start learning today. These skills do not require you to come from a specific education background. If you are passionate about learning any of these skills, then you can easily find so many free resources on the internet. If you don’t know how to find free resources to learn these skills, feel free to reach me @aman.kharwal, I will be happy to guide you.",#career #job #jobs #jobsearch #education #business #success #careergoals #motivation #work #careerdevelopment #careers #goals #resume #students #careeradvice #datascience #marketing #digitalmarketing #media #socialmedia #IT #webdevelopment #amankharwal #thecleverprogrammer
121,8,1,21,2,3169,"In Data Science, Time Series Analysis is a method of analyzing data collected over an interval of time. Stock price data and covid-19 cases data are examples of time-series data. Time Series Analysis helps understand the underlying causes of trends and patterns at particular time intervals. So it is one of the topics that every data scientist should know perfectly. So if you are looking for some of the best data science project ideas on Time Series Analysis, you should try to work on these projects.",#timeseries #time #statistics #datascience #bigdata #machinelearning #python #ai #timeseriesanalysis #datavisualization #dataanalytics #data #iot #analysis #timeseriesmalaysia #artificialintelligence #analytics #amankharwal #thecleverprogrammer
151,6,6,77,30,6168,"Stress, anxiety, and depression are threatening the mental health of people. Every person has a reason for having a stressful life. People often share their feelings on social media platforms like on Instagram in the form of posts and stories, and on Reddit in the form of asking for suggestions about their life on subreddits. In the past few years, many content creators have come forward to create content to help people with their mental health. Many organizations can use stress detection to find which social media users are stressed to help them quickly. So if you want to learn how to use machine learning to detect stress on social media posts, this data science project is for you. Detection of stress from social media posts with machine learning using Python: Link in Bio.",#data #datascience #dataanalysis #dataanalytics #datascientist #machinelearning #python #pythonprogramming #pythonprojects #pythoncode #artificialintelligence #ai #deeplearning #machinelearningprojects #datascienceprojects #amankharwal #thecleverprogrammer #machinelearningmodels #stress #stressdetection
72,8,20,10,0,2407,Data Science Use Cases: Here’s how Zomato is using your data for its future business model.,#data #datascience #dataanalysis #dataanalytics #datascientist #machinelearning #python #pythonprogramming #pythonprojects #pythoncode #artificialintelligence #ai #deeplearning #machinelearningprojects #datascienceprojects #amankharwal #thecleverprogrammer #machinelearningmodels #zomato #business #casestudy #businessmodel
76,4,5,9,0,2064,"A boxplot is a statistical data visualization technique for analyzing the distribution and patterns of numerical data points of a dataset. It represents quartile 1, quartile 3, median, maximum and minimum data points of a feature which helps to understand the distribution of the numerical values of a dataset. Here’s how to analyze box plots as a Data Scientist.",#datavisualization #datascience #data #dataanalytics #machinelearning #dataanalysis #artificialintelligence #python #datascientist #bigdata #deeplearning #dataviz #ai #analytics #technology #dataanalyst #programming #pythonprogramming #statistics #coding #businessintelligence #datamining #tech #business #boxplots #thecleverprogrammer #amankharwal
91,3,4,11,24,3973,"Activation Functions are functions used in neural networks for calculating the weighted sum of input and biases. It's done to determine if a neuron should be activated or not. What happens is that the input layer receives the training data for training the neural network, the hidden layer is used to do all the calculations which help in finding relationships between the features of the data, and then the output layer gives the results which are controlled by the activation functions. They are placed after the hidden layers to produce the results for the neural network.",#neuralnetwork #machinelearning #artificialintelligence #deeplearning #python #ai #datascience #neuralnetworks #programming #tensorflow #datascientist #pythonprogramming #tech #technology #artificialintelligenceai #machinelearningalgorithms #computerscience #coding #ml #data #amankharwal #thecleverprogrammer
195,7,9,144,100,7281,Learn how to send automatic emails using the Python programming language: Link in bio.,#python #pythonprogramming #pythonprojects #pythoncode #pythonlearning #pythondeveloper #pythoncoding #pythonprogrammer #amankharwal #thecleverprogrammer #pythonprojects
129,5,14,14,2,3052,Here are all the programming languages that Google uses in the Front-end and the back-end of Google.,#programming #coding #programmer #python #developer #javascript #technology #code #coder #java #html #computerscience #tech #css #webdeveloper #software #webdevelopment #codinglife #softwaredeveloper #linux #programmingmemes #webdesign #programmers #php #programminglife #machinelearning #hacking #pythonprogramming #thecleverprogrammer #amankharwal
160,8,3,10,4,4628,"Deep Learning is a subset of machine learning. If you want to become a machine learning engineer, you should know everything about deep learning. If you are looking for some of the best free resources to learn deep learning then here are the two best free resources to learn deep learning.",#deeplearning #machinelearning #artificialintelligence #datascience #ai #python #coding #technology #programming #bigdata #dataanalytics #datascientist #data #computerscience #tech #neuralnetwork #amankharwal #thecleverprogrammer
175,11,5,19,6,4082,Deep learning is a subset of machine learning in which we use artificial neural networks to train models to solve complex problems where we need a large amount of data compared to other machine learning algorithms. Here are some of the best deep learning project ideas that you must try.,#deeplearning #machinelearning #artificialintelligence #datascience #ai #python #coding #technology #programming #bigdata #dataanalytics #datascientist #data #computerscience #tech #neuralnetwork #amankharwal #thecleverprogrammer
147,19,6,69,6,5394,"You must have heard or invested in any cryptocurrency once in your life. It is a digital medium of exchange that is encrypted and decentralized. If you want to know how to predict the future prices of any cryptocurrency with machine learning, this will help you. Here you will learn how to predict the future prices of bitcoin with machine learning using Python.",#data #datascience #dataanalysis #dataanalytics #datascientist #machinelearning #python #pythonprogramming #pythonprojects #pythoncode #artificialintelligence #ai #deeplearning #machinelearningprojects #datascienceprojects #amankharwal #thecleverprogrammer #bitcoin #cryptocurrency
114,10,4,11,6,2766,Here are all the programming languages that Facebook uses in the Front-end and the back-end of Facebook.,#programming #coding #programmer #python #developer #javascript #technology #code #coder #java #html #computerscience #tech #css #webdeveloper #software #webdevelopment #codinglife #softwaredeveloper #linux #programmingmemes #webdesign #programmers #php #programminglife #machinelearning #hacking #pythonprogramming #thecleverprogrammer #amankharwal
151,11,3,19,2,3924,Here are some of the most popular data science case studies and projects that every data science beginner should try. You can find these case studies and projects with solutions at Kaggle.,#data #datascience #dataanalysis #dataanalytics #datascientist #machinelearning #python #pythonprogramming #pythonprojects #pythoncode #artificialintelligence #ai #deeplearning #algorithm #algorithms #machinelearningalgorithms #ml #amankharwal #thecleverprogrammer #projects #casestudies
92,11,4,9,2,3015,Here’s how Amazon uses your data as an e-commerce platform. I hope this post will help you to understand how Amazon is using data science to improve the quality of its services.,#data #datascience #dataanalysis #dataanalytics #datascientist #machinelearning #python #pythonprogramming #pythonprojects #pythoncode #artificialintelligence #ai #deeplearning #machinelearningprojects #datascienceprojects #amankharwal #thecleverprogrammer #machinelearningmodels #zomato #business #casestudy #businessmodel #amazonfinds
214,9,3,57,20,6666,Google Search Analysis is one of the best data analysis project ideas for someone who wants to work as a data analyst in marketing. Here your task is to analyze the search trends on Google. You can learn how to analyze the google search trends by visiting the link in bio.,#data #datascience #dataanalysis #dataanalytics #datascientist #machinelearning #python #pythonprogramming #pythonprojects #pythoncode #artificialintelligence #ai #deeplearning #machinelearningprojects #datascienceprojects #amankharwal #thecleverprogrammer
150,11,15,13,2,3854,Here are all the databases that Google uses.,#data #technology #datascience #business #tech #bigdata #dataanalytics #machinelearning #ai #analytics #datavisualization #security #artificialintelligence #cybersecurity #programming #python #software #coding #network #internet #cloud #dataanalysis #innovation #datascientist #database #amankharwal #thecleverprogrammer #google
122,8,4,11,4,4355,Here are some of the popular programming languages with their uses.,#programming #coding #programmer #python #developer #javascript #technology #code #coder #java #html #computerscience #tech #css #webdeveloper #software #webdevelopment #codinglife #softwaredeveloper #linux #programmingmemes #webdesign #programmers #php #programminglife #machinelearning #hacking #pythonprogramming #thecleverprogrammer #amankharwal
152,6,3,24,8,4343,Natural language processing or NLP is a subfield of artificial intelligence where we build applications to interact with humans. Here is the complete process that you should follow while working on every problem based on natural language processing.,#data #datascience #dataanalysis #dataanalytics #datascientist #machinelearning #python #pythonprogramming #pythonprojects #pythoncode #artificialintelligence #ai #deeplearning #sentimentanalysis #sentiment #nlp #naturallanguageprocessing #amankharwal #thecleverprogrammer
196,7,8,81,26,6108,LSTM stands for Long Short Term Memory Networks. It is a type of recurrent neural network that is commonly used for regression and time series forecasting in machine learning. Here you will learn how to use the LSTM Neural Network for the task of Stock Price Prediction using Python.,#neuralnetwork #machinelearning #artificialintelligence #deeplearning #python #ai #datascience #neuralnetworks #programming #tensorflow #datascientist #pythonprogramming #tech #technology #artificialintelligenceai #machinelearningalgorithms #computerscience #coding #ml #data #amankharwal #thecleverprogrammer
86,6,0,4,2,2523,Tokenization is the first step you should perform after collecting a textual dataset in every problem based on Natural Language Processing. Sentence and Word tokenization are two different strategies of tokenization that you should know.,#data #datascience #dataanalysis #dataanalytics #datascientist #machinelearning #python #pythonprogramming #pythonprojects #pythoncode #artificialintelligence #ai #deeplearning #sentimentanalysis #sentiment #nlp #naturallanguageprocessing #amankharwal #thecleverprogrammer
85,3,3,7,2,2327,Here are all the databases that are used by Facebook.,#data #technology #datascience #business #tech #bigdata #dataanalytics #machinelearning #ai #analytics #datavisualization #security #artificialintelligence #cybersecurity #programming #python #software #coding #network #internet #cloud #dataanalysis #innovation #datascientist #database #amankharwal #thecleverprogrammer #facebook
156,4,11,14,4,3990,Here are some of the best data science project ideas on natural language processing that you should try.,#data #datascience #dataanalysis #dataanalytics #datascientist #machinelearning #python #pythonprogramming #pythonprojects #pythoncode #artificialintelligence #ai #deeplearning #sentimentanalysis #sentiment #nlp #naturallanguageprocessing #amankharwal #thecleverprogrammer
72,2,1,18,0,2191,Language detection is a natural language processing task where we need to identify the language of a text or document. Here you will learn how to train a machine learning model for language detection using Python.,#data #datascience #dataanalysis #dataanalytics #datascientist #machinelearning #python #pythonprogramming #pythonprojects #pythoncode #artificialintelligence #ai #deeplearning #sentimentanalysis #sentiment #nlp #naturallanguageprocessing #amankharwal #thecleverprogrammer
82,6,3,8,2,1941,A neural network is a computational structure that connects an input layer to an output layer. Here’s how a neural network works.,#neuralnetwork #machinelearning #artificialintelligence #deeplearning #python #ai #datascience #neuralnetworks #programming #tensorflow #datascientist #pythonprogramming #tech #technology #artificialintelligenceai #machinelearningalgorithms #computerscience #coding #ml #data #amankharwal #thecleverprogrammer
416,6,20,330,94,16062,280 Machine Learning Projects Solved & Explained using Python programming language: Link in Bio,#data #datascience #dataanalysis #dataanalytics #datascientist #machinelearning #python #pythonprogramming #pythonprojects #pythoncode #artificialintelligence #ai #deeplearning #machinelearningprojects #datascienceprojects #amankharwal #thecleverprogrammer
180,4,13,21,8,4998,Here is how you can prepare yourself for your very first data science interview.,#data #datascience #dataanalysis #dataanalytics #datascientist #machinelearning #python #pythonprogramming #pythonprojects #pythoncode #artificialintelligence #ai #deeplearning #machinelearningprojects #datascienceprojects #amankharwal #thecleverprogrammer #interview #datascienceinterview
150,8,4,19,18,4289,Here is the difference between the process of Deep Learning and Machine Learning.,#data #datascience #dataanalysis #dataanalytics #datascientist #machinelearning #python #pythonprogramming #pythonprojects #pythoncode #artificialintelligence #ai #deeplearning #machinelearningprojects #datascienceprojects #amankharwal #thecleverprogrammer #interview #neuralnetworks
127,4,2,32,10,3880,"Each company has its ways of creating an OTP for verification, but most of the companies have their systems programmed to generate a 6-digit random number. So here you will learn the complete process of OTP verification using Python.",#python #pythonprogramming #pythonprojects #pythoncode #pythonlearning #pythondeveloper #pythoncoding #pythonprogrammer #amankharwal #thecleverprogrammer #pythonprojects #otp #otpverification
167,9,5,19,4,3786,Here’s how you can create a QR code by using the Python programming language.,#python #pythonprogramming #pythonprojects #pythoncode #pythonlearning #pythondeveloper #pythoncoding #pythonprogrammer #amankharwal #thecleverprogrammer #pythonprojects #qrcodes
225,6,19,21,4,4298,Here are some of the best Python project ideas for resume that you can work on as a Python developer.,#python #pythonprogramming #pythonprojects #pythoncode #pythonlearning #pythondeveloper #pythoncoding #pythonprogrammer #amankharwal #thecleverprogrammer #pythonprojects
137,4,10,14,4,3630,Here are some of the best data analysis project ideas for resume that you should try.,#data #datascience #dataanalysis #dataanalytics #datascientist #machinelearning #python #pythonprogramming #pythonprojects #pythoncode #artificialintelligence #ai #deeplearning #machinelearningprojects #datascienceprojects #amankharwal #thecleverprogrammer
114,3,3,30,4,2826,Visualizing data is one of the most valuable skills every Data Scientist and Analyst should have. There are a lot of data visualizations to learn in data science. Here you will find a list of all data visualizations for data science explained using Python.,#dataanalytics #datascience #data #machinelearning #datavisualization #bigdata #artificialintelligence #datascientist #python #analytics #ai #dataanalysis #deeplearning #technology #programming #coding #dataanalyst #business #pythonprogramming #datamining #tech #businessintelligence #database #computerscience #statistics #powerbi #dataanalysisprojects #businessanalytics #thecleverprogrammer #amankharwal
263,5,15,39,18,7407,Here are some of the most important machine learning algorithms that every beginner in machine learning should know.,#data #datascience #dataanalysis #dataanalytics #datascientist #machinelearning #python #pythonprogramming #pythonprojects #pythoncode #artificialintelligence #ai #deeplearning #machinelearningprojects #datascienceprojects #amankharwal #thecleverprogrammer
328,8,41,42,38,10386,Here are some of the best websites that you can follow to learn everything in data science.,#data #datascience #dataanalysis #dataanalytics #datascientist #machinelearning #python #pythonprogramming #pythonprojects #pythoncode #artificialintelligence #ai #deeplearning #machinelearningprojects #datascienceprojects #amankharwal #thecleverprogrammer
126,4,1,31,10,2998,Time series analysis means analyzing and finding patterns in a time series dataset. A time-series dataset is a sequence of data collected over an interval of time. Here you will learn how to do Time Series Analysis using Python.,#timeseries #time #statistics #datascience #bigdata #machinelearning #python #ai #timeseriesanalysis #datavisualization #dataanalytics #data #iot #analysis #timeseriesmalaysia #artificialintelligence #analytics #amankharwal #thecleverprogrammer
