Likes,Comments,Shares,Profile Visits,Follows,Engagement,Caption,Hashtags
236,9,16,20,12,7018,Here are some of the best data sources that you can use to collect data for your data science projects.,#data #datascience #dataanalysis #dataanalytics #datascientist #machinelearning #python #pythonprogramming #pythonprojects #pythoncode #artificialintelligence #ai #deeplearning #machinelearningprojects #datascienceprojects #amankharwal #thecleverprogrammer
99,2,1,12,4,2941,"One of the mistakes data science newbies make while working on a machine learning project is that they train a machine learning model, check its accuracy score, and then complete the project. They do not test the performance of the model by giving inputs to the model based on the features they used to train it. Here you will learn how to give inputs to a machine learning model to test its performance.",#data #datascience #dataanalysis #dataanalytics #datascientist #machinelearning #python #pythonprogramming #pythonprojects #pythoncode #artificialintelligence #ai #deeplearning #machinelearningprojects #datascienceprojects #amankharwal #thecleverprogrammer
212,11,8,22,4,6432,Here are some of the best data science project ideas for resume that you should try in 2022.,#data #datascience #dataanalysis #dataanalytics #datascientist #machinelearning #python #pythonprogramming #pythonprojects #pythoncode #artificialintelligence #ai #deeplearning #machinelearningprojects #datascienceprojects #amankharwal #thecleverprogrammer
297,13,15,306,74,10667,170 Python Projects with Source Code solved and explained for free: Link in Bio,#python #pythonprogramming #pythonprojects #pythoncode #pythonlearning #pythondeveloper #pythoncoding #pythonprogrammer #amankharwal #thecleverprogrammer #pythonprojects
142,6,9,13,0,3988,Here are some of the most important data visualizations that every data scientist must know.,#datavisualization #datascience #data #dataanalytics #machinelearning #dataanalysis #artificialintelligence #python #datascientist #bigdata #deeplearning #dataviz #ai #analytics #technology #dataanalyst #programming #pythonprogramming #statistics #coding #businessintelligence #datamining #tech #business #computerscience #tableau #database #bigdataanalytics #powerbi
186,9,2,26,6,4978,Here are some of the best data science projects ideas based on recommendation systems that you should try.,#recommended #recommendations #recommendationsystem #recommendation #data #datascience #dataanalysis #dataanalytics #datascientist #machinelearning #python #pythonprogramming #pythonprojects #pythoncode #artificialintelligence #ai #amankharwal #thecleverprogrammer
112,1,7,16,6,3388,"Variance, covariance, and correlation are statistical measures for finding the relationship between data points in a dataset. Here’s the difference between variance, covariance, and correlation that you should know.",#datavisualization #datascience #data #dataanalytics #machinelearning #dataanalysis #artificialintelligence #python #datascientist #bigdata #deeplearning #dataviz #ai #analytics #technology #dataanalyst #programming #pythonprogramming #statistics #amankharwal #thecleverprogrammer
149,3,16,15,0,4467,Here are some of the popular applications of data science in finance.,#data #datascience #dataanalysis #dataanalytics #datascientist #machinelearning #python #pythonprogramming #pythonprojects #pythoncode #artificialintelligence #ai #deeplearning #machinelearningprojects #datascienceprojects #amankharwal #thecleverprogrammer #finance #business #money #investing
132,5,14,15,6,3246,Here are some of the best websites to prepare for coding interviews.,#coding #programming #programmer #python #developer #javascript #code #coder #technology #html #computerscience #codinglife #java #webdeveloper #tech #css #webdevelopment #software #softwaredeveloper #interview #job #codinginterview #amankharwal #thecleverprogrammer
115,7,6,39,12,5072,"The introduction of online payment systems has helped a lot in the ease of payments. But, at the same time, it increased in payment frauds. Here you will learn how to detect online payment frauds with machine learning using Python.",#data #datascience #dataanalysis #dataanalytics #datascientist #machinelearning #python #pythonprogramming #pythonprojects #pythoncode #artificialintelligence #ai #deeplearning #machinelearningprojects #datascienceprojects #amankharwal #thecleverprogrammer
248,8,5,21,10,6339,Here are some of the best data science project ideas on healthcare. If you want to become a data science professional in the healthcare domain then you must try to work on these projects.,#healthcare #health #covid #data #datascience #dataanalysis #dataanalytics #datascientist #machinelearning #python #pythonprogramming #pythonprojects #pythoncode #artificialintelligence #ai #dataanalyst #amankharwal #thecleverprogrammer
178,2,1,8,8,4239,Here are some of the most important tools that I use daily as a Data Scientist/Analyst.,#data #datascience #dataanalysis #dataanalytics #datascientist #machinelearning #python #pythonprogramming #pythonprojects #pythoncode #artificialintelligence #ai #deeplearning #machinelearningprojects #datascienceprojects #amankharwal #thecleverprogrammer
107,0,0,45,8,3454,Here you will learn how to visualize the linear regression algorithm in machine learning using Python. Find this complete tutorial from the link in bio??,#data #datascience #dataanalysis #dataanalytics #datascientist #machinelearning #python #pythonprogramming #pythonprojects #pythoncode #artificialintelligence #ai #deeplearning #algorithm #algorithms #machinelearningalgorithms #amankharwal #thecleverprogrammer
269,7,12,50,46,7571,Here are some of the very useful Python scripts that you can use to solve real-time problems in your projects.,#python #pythonprogramming #pythonprojects #pythoncode #pythonlearning #pythondeveloper #pythoncoding #pythonprogrammer #amankharwal #thecleverprogrammer
96,3,5,37,12,3333,"If you want to know how to predict the future prices of any cryptocurrency with machine learning, this will help you. Here you will learn how to predict the future prices of bitcoin with machine learning using Python.",#data #datascience #dataanalysis #dataanalytics #datascientist #machinelearning #python #pythonprogramming #pythonprojects #pythoncode #artificialintelligence #ai #deeplearning #machinelearningprojects #datascienceprojects #amankharwal #thecleverprogrammer #bitcoin #cryptocurrency
134,6,0,25,10,3818,"To calculate the execution time of the program, we need to calculate the time taken by the program from its initiation to the final result. Here’s how to calculate the execution time of a Python program.",#python #pythonprogramming #pythonprojects #pythoncode #pythonlearning #pythondeveloper #pythoncoding #pythonprogrammer #amankharwal #thecleverprogrammer
301,13,15,347,94,10933,170 Python Projects with Source Code solved and explained for free: Link in Bio,#python #pythonprogramming #pythonprojects #pythoncode #pythonlearning #pythondeveloper #pythoncoding #pythonprogrammer #amankharwal #thecleverprogrammer #pythonprojects
187,9,2,26,6,5058,Here are some of the best data science projects ideas based on recommendation systems that you should try.,#recommended #recommendations #recommendationsystem #recommendation #data #datascience #dataanalysis #dataanalytics #datascientist #machinelearning #python #pythonprogramming #pythonprojects #pythoncode #artificialintelligence #ai #amankharwal #thecleverprogrammer
94,0,3,48,10,3601,One of the most popular use cases of data science is the task of sentiment analysis of product reviews sold on e-commerce platforms. Here you will learn how to analyze the sentiments of Flipkart reviews using Python.,#data #datascience #dataanalysis #dataanalytics #datascientist #machinelearning #python #pythonprogramming #pythonprojects #pythoncode #artificialintelligence #ai #deeplearning #sentimentanalysis #sentiment #nlp #naturallanguageprocessing #amankharwal #thecleverprogrammer #flipkart
114,1,7,16,6,3480,"Variance, covariance, and correlation are statistical measures for finding the relationship between data points in a dataset. Here’s the difference between variance, covariance, and correlation that you should know.",#datavisualization #datascience #data #dataanalytics #machinelearning #dataanalysis #artificialintelligence #python #datascientist #bigdata #deeplearning #dataviz #ai #analytics #technology #dataanalyst #programming #pythonprogramming #statistics #amankharwal #thecleverprogrammer
96,5,0,26,4,3525,You must have seen the news divided into categories when you go to a news website. Here you will learn how to classify news articles with machine learning using Python.,#data #datascience #dataanalysis #dataanalytics #datascientist #machinelearning #python #pythonprogramming #pythonprojects #pythoncode #artificialintelligence #ai #deeplearning #machinelearningprojects #datascienceprojects #amankharwal #thecleverprogrammer #news
138,5,15,17,12,3606,Here are some of the best websites to prepare for coding interviews.,#coding #programming #programmer #python #developer #javascript #code #coder #technology #html #computerscience #codinglife #java #webdeveloper #tech #css #webdevelopment #software #softwaredeveloper #interview #job #codinginterview #amankharwal #thecleverprogrammer
122,7,6,52,16,5542,"The introduction of online payment systems has helped a lot in the ease of payments. But, at the same time, it increased in payment frauds. Here you will learn how to detect online payment frauds with machine learning using Python.",#data #datascience #dataanalysis #dataanalytics #datascientist #machinelearning #python #pythonprogramming #pythonprojects #pythoncode #artificialintelligence #ai #deeplearning #machinelearningprojects #datascienceprojects #amankharwal #thecleverprogrammer
257,8,6,22,12,6559,Here are some of the best data science project ideas on healthcare. If you want to become a data science professional in the healthcare domain then you must try to work on these projects.,#healthcare #health #covid #data #datascience #dataanalysis #dataanalytics #datascientist #machinelearning #python #pythonprogramming #pythonprojects #pythoncode #artificialintelligence #ai #dataanalyst #amankharwal #thecleverprogrammer
95,3,0,41,8,3623,Learn how to create an interactive language translator using Python: Link in Bio,#python #pythonprogramming #pythonprojects #pythoncode #pythonlearning #pythondeveloper #pythoncoding #pythonprogrammer #amankharwal #thecleverprogrammer #naturallanguageprocessing #nlp
244,9,1,155,32,10493,Here is a list of 100+ Machine Learning Algorithms and Models explained using Python that will help you to understand the implementation of all the machine learning algorithms and models in solving real-time business problems. You can find this list of 100+ Machine Learning Algorithms and Models from the link in bio.,#data #datascience #dataanalysis #dataanalytics #datascientist #machinelearning #python #pythonprogramming #pythonprojects #pythoncode #artificialintelligence #ai #deeplearning #algorithm #algorithms #machinelearningalgorithms #amankharwal #thecleverprogrammer
190,6,11,12,8,4446,Here are some of the best YouTube channels that you can follow to learn data science.,#data #datascience #dataanalysis #dataanalytics #datascientist #machinelearning #python #pythonprogramming #pythonprojects #pythoncode #artificialintelligence #ai #deeplearning #machinelearningprojects #datascienceprojects #amankharwal #thecleverprogrammer
118,4,2,22,16,2957,Python program to count the number of capital letters from a file.,#python #pythonprogramming #pythonprojects #pythoncode #pythonlearning #pythondeveloper #pythoncoding #pythonprogrammer #amankharwal #thecleverprogrammer #pythonprogram @codergallery
178,6,6,20,6,5538,"Follow these steps to collect your WhatsApp chat data for a data science project. You can use your WhatsApp chat data for Text Analysis, Sentiment Analysis, and many more tasks based on Natural Language Processing.",#data #datascience #dataanalysis #dataanalytics #datascientist #machinelearning #python #pythonprogramming #pythonprojects #pythoncode #artificialintelligence #ai #deeplearning #machinelearningprojects #datascienceprojects #amankharwal #thecleverprogrammer #whatsapp
170,7,12,23,10,4681,Here are some of the best resources on the internet to learn machine learning for free.,#data #datascience #dataanalysis #dataanalytics #datascientist #machinelearning #python #pythonprogramming #pythonprojects #pythoncode #artificialintelligence #ai #deeplearning #machinelearningprojects #datascienceprojects #amankharwal #thecleverprogrammer
250,9,22,25,10,5273,"Here is a complete roadmap to data science that you can follow to learn data science from scratch. All the resources to learn from are also mentioned here. Swipe>>, Save, and Share.",#data #datascience #dataanalysis #dataanalytics #datascientist #machinelearning #python #pythonprogramming #pythonprojects #pythoncode #artificialintelligence #ai #deeplearning #machinelearningprojects #datascienceprojects #amankharwal #thecleverprogrammer #roadmap
159,7,11,17,6,5055,"In Data Science, Time Series Analysis is a method of analyzing data collected over an interval of time. Stock price data and covid-19 cases data are examples of time-series data. Time Series Analysis helps understand the underlying causes of trends and patterns at particular time intervals. So it is one of the topics that every data scientist should know perfectly. So if you are looking for some of the best books to learn Time Series Analysis, you can choose any one among these books.",#timeseries #time #statistics #datascience #bigdata #machinelearning #python #ai #timeseriesanalysis #datavisualization #dataanalytics #data #iot #analysis #timeseriesmalaysia #artificialintelligence #analytics #amankharwal #thecleverprogrammer
205,17,18,16,2,4002,"Here are some of the highest paying skills in 2022 that you should start learning today. These skills do not require you to come from a specific education background. If you are passionate about learning any of these skills, then you can easily find so many free resources on the internet. If you don’t know how to find free resources to learn these skills, feel free to reach me @aman.kharwal, I will be happy to guide you.",#career #job #jobs #jobsearch #education #business #success #careergoals #motivation #work #careerdevelopment #careers #goals #resume #students #careeradvice #datascience #marketing #digitalmarketing #media #socialmedia #IT #webdevelopment #amankharwal #thecleverprogrammer
121,8,1,21,2,3169,"In Data Science, Time Series Analysis is a method of analyzing data collected over an interval of time. Stock price data and covid-19 cases data are examples of time-series data. Time Series Analysis helps understand the underlying causes of trends and patterns at particular time intervals. So it is one of the topics that every data scientist should know perfectly. So if you are looking for some of the best data science project ideas on Time Series Analysis, you should try to work on these projects.",#timeseries #time #statistics #datascience #bigdata #machinelearning #python #ai #timeseriesanalysis #datavisualization #dataanalytics #data #iot #analysis #timeseriesmalaysia #artificialintelligence #analytics #amankharwal #thecleverprogrammer
151,6,6,77,30,6168,"Stress, anxiety, and depression are threatening the mental health of people. Every person has a reason for having a stressful life. People often share their feelings on social media platforms like on Instagram in the form of posts and stories, and on Reddit in the form of asking for suggestions about their life on subreddits. In the past few years, many content creators have come forward to create content to help people with their mental health. Many organizations can use stress detection to find which social media users are stressed to help them quickly. So if you want to learn how to use machine learning to detect stress on social media posts, this data science project is for you. Detection of stress from social media posts with machine learning using Python: Link in Bio.",#data #datascience #dataanalysis #dataanalytics #datascientist #machinelearning #python #pythonprogramming #pythonprojects #pythoncode #artificialintelligence #ai #deeplearning #machinelearningprojects #datascienceprojects #amankharwal #thecleverprogrammer #machinelearningmodels #stress #stressdetection
72,8,20,10,0,2407,Data Science Use Cases: Here’s how Zomato is using your data for its future business model.,#data #datascience #dataanalysis #dataanalytics #datascientist #machinelearning #python #pythonprogramming #pythonprojects #pythoncode #artificialintelligence #ai #deeplearning #machinelearningprojects #datascienceprojects #amankharwal #thecleverprogrammer #machinelearningmodels #zomato #business #casestudy #businessmodel
137,4,10,14,4,3630,Here are some of the best data analysis project ideas for resume that you should try.,#data #datascience #dataanalysis #dataanalytics #datascientist #machinelearning #python #pythonprogramming #pythonprojects #pythoncode #artificialintelligence #ai #deeplearning #machinelearningprojects #datascienceprojects #amankharwal #thecleverprogrammer
114,3,3,30,4,2826,Visualizing data is one of the most valuable skills every Data Scientist and Analyst should have. There are a lot of data visualizations to learn in data science. Here you will find a list of all data visualizations for data science explained using Python.,#dataanalytics #datascience #data #machinelearning #datavisualization #bigdata #artificialintelligence #datascientist #python #analytics #ai #dataanalysis #deeplearning #technology #programming #coding #dataanalyst #business #pythonprogramming #datamining #tech #businessintelligence #database #computerscience #statistics #powerbi #dataanalysisprojects #businessanalytics #thecleverprogrammer #amankharwal
263,5,15,39,18,7407,Here are some of the most important machine learning algorithms that every beginner in machine learning should know.,#data #datascience #dataanalysis #dataanalytics #datascientist #machinelearning #python #pythonprogramming #pythonprojects #pythoncode #artificialintelligence #ai #deeplearning #machinelearningprojects #datascienceprojects #amankharwal #thecleverprogrammer
328,8,41,42,38,10386,Here are some of the best websites that you can follow to learn everything in data science.,#data #datascience #dataanalysis #dataanalytics #datascientist #machinelearning #python #pythonprogramming #pythonprojects #pythoncode #artificialintelligence #ai #deeplearning #machinelearningprojects #datascienceprojects #amankharwal #thecleverprogrammer
126,4,1,31,10,2998,Time series analysis means analyzing and finding patterns in a time series dataset. A time-series dataset is a sequence of data collected over an interval of time. Here you will learn how to do Time Series Analysis using Python.,#timeseries #time #statistics #datascience #bigdata #machinelearning #python #ai #timeseriesanalysis #datavisualization #dataanalytics #data #iot #analysis #timeseriesmalaysia #artificialintelligence #analytics #amankharwal #thecleverprogrammer
129,5,14,14,2,3052,Here are all the programming languages that Google uses in the Front-end and the back-end of Google.,#programming #coding #programmer #python #developer #javascript #technology #code #coder #java #html #computerscience #tech #css #webdeveloper #software #webdevelopment #codinglife #softwaredeveloper #linux #programmingmemes #webdesign #programmers #php #programminglife #machinelearning #hacking #pythonprogramming #thecleverprogrammer #amankharwal
160,8,3,10,4,4628,"Deep Learning is a subset of machine learning. If you want to become a machine learning engineer, you should know everything about deep learning. If you are looking for some of the best free resources to learn deep learning then here are the two best free resources to learn deep learning.",#deeplearning #machinelearning #artificialintelligence #datascience #ai #python #coding #technology #programming #bigdata #dataanalytics #datascientist #data #computerscience #tech #neuralnetwork #amankharwal #thecleverprogrammer
175,11,5,19,6,4082,Deep learning is a subset of machine learning in which we use artificial neural networks to train models to solve complex problems where we need a large amount of data compared to other machine learning algorithms. Here are some of the best deep learning project ideas that you must try.,#deeplearning #machinelearning #artificialintelligence #datascience #ai #python #coding #technology #programming #bigdata #dataanalytics #datascientist #data #computerscience #tech #neuralnetwork #amankharwal #thecleverprogrammer
147,19,6,69,6,5394,"You must have heard or invested in any cryptocurrency once in your life. It is a digital medium of exchange that is encrypted and decentralized. If you want to know how to predict the future prices of any cryptocurrency with machine learning, this will help you. Here you will learn how to predict the future prices of bitcoin with machine learning using Python.",#data #datascience #dataanalysis #dataanalytics #datascientist #machinelearning #python #pythonprogramming #pythonprojects #pythoncode #artificialintelligence #ai #deeplearning #machinelearningprojects #datascienceprojects #amankharwal #thecleverprogrammer #bitcoin #cryptocurrency
114,10,4,11,6,2766,Here are all the programming languages that Facebook uses in the Front-end and the back-end of Facebook.,#programming #coding #programmer #python #developer #javascript #technology #code #coder #java #html #computerscience #tech #css #webdeveloper #software #webdevelopment #codinglife #softwaredeveloper #linux #programmingmemes #webdesign #programmers #php #programminglife #machinelearning #hacking #pythonprogramming #thecleverprogrammer #amankharwal
151,11,3,19,2,3924,Here are some of the most popular data science case studies and projects that every data science beginner should try. You can find these case studies and projects with solutions at Kaggle.,#data #datascience #dataanalysis #dataanalytics #datascientist #machinelearning #python #pythonprogramming #pythonprojects #pythoncode #artificialintelligence #ai #deeplearning #algorithm #algorithms #machinelearningalgorithms #ml #amankharwal #thecleverprogrammer #projects #casestudies
92,11,4,9,2,3015,Here’s how Amazon uses your data as an e-commerce platform. I hope this post will help you to understand how Amazon is using data science to improve the quality of its services.,#data #datascience #dataanalysis #dataanalytics #datascientist #machinelearning #python #pythonprogramming #pythonprojects #pythoncode #artificialintelligence #ai #deeplearning #machinelearningprojects #datascienceprojects #amankharwal #thecleverprogrammer #machinelearningmodels #zomato #business #casestudy #businessmodel #amazonfinds
,,,,,,,
